<?xml version="1.0" encoding="UTF-8"?>
<!DOCTYPE orders SYSTEM "../dtds/don_hang.dtd">

<orders>
    <list_orders>
        <order id="O001" customer_id="U001">
            <customer_name>John Doe</customer_name>
            <tel>0123456789</tel>
            <order_date>2024-06-15</order_date>
            <status>Processing</status>
            <address>123 Main St, Anytown, USA</address>
            <payment_method>Credit Card</payment_method>
            <discount>10.4</discount>
            <total_amount>150.75</total_amount>
            <note>Please deliver between 9 AM and 5 PM.</note>
        </order>

        <order id="O002" customer_id="U002">
            <customer_name>Jane Smith</customer_name>
            <tel>9876543210</tel>
            <order_date>2024-06-16</order_date>
            <status>Shipped</status>
            <address>456 Elm St, Othertown, USA</address>
            <payment_method>PayPal</payment_method>
            <discount>5.0</discount>
            <total_amount>89.50</total_amount>
        </order>

        <order id="O003" customer_id="U003">
            <customer_name>Emily Johnson</customer_name>
            <tel>0123456789</tel>
            <order_date>2024-06-17</order_date>
            <status>Delivered</status>
            <address>789 Oak St, Sometown, USA</address>
            <payment_method>Credit Card</payment_method>
            <discount>0.0</discount>
            <total_amount>45.00</total_amount>
        </order>

        <order id="O004" customer_id="U003">
            <customer_name>Michael Brown</customer_name>
            <tel>0123456789</tel>
            <order_date>2024-06-18</order_date>
            <status>Cancelled</status>
            <address>321 Pine St, Anycity, USA</address>
            <payment_method>Credit Card</payment_method>
            <discount>15.0</discount>
            <total_amount>120.00</total_amount>
        </order>

        <order id="O005" customer_id="U004">
            <customer_name>Sarah Davis</customer_name>
            <tel>0123456789</tel>
            <order_date>2024-06-19</order_date>
            <status>Processing</status>
            <address>654 Maple St, Anycity, USA</address>
            <payment_method>Credit Card</payment_method>
            <discount>10.0</discount>
            <total_amount>75.25</total_amount>
        </order>

        <order id="O006" customer_id="U005">
            <customer_name>David Wilson</customer_name>
            <tel>0123456789</tel>
            <order_date>2024-06-20</order_date>
            <status>Processing</status>
            <address>987 Cedar St, Anycity, USA</address>
            <payment_method>Credit Card</payment_method>
            <discount>0.0</discount>
            <total_amount>200.00</total_amount>
        </order>
        
        <order id="O007" customer_id="U006">
            <customer_name>Laura Martinez</customer_name>
            <tel>0123456789</tel>
            <order_date>2024-06-21</order_date>
            <status>Processing</status>
            <address>123 Birch St, Anycity, USA</address>
            <payment_method>Credit Card</payment_method>
            <discount>20.0</discount>
            <total_amount>300.00</total_amount>
        </order>
    </list_orders>
    <customers>
        <customer id="U001"/>
        <customer id="U002"/>
        <customer id="U003"/>
        <customer id="U004"/>
        <customer id="U005"/>
        <customer id="U006"/>
        <customer id="U007">
    </customers>
</orders>